{
  "artifact_digest": "7affc8a977bc6371dcd4bb99256394436927723cf0d8e90febde3b1b3706100f",
  "authority_class": "human_governance",
  "authorization_id": "0d7a1648-b585-54e8-b80a-129e6409b6d6",
  "authorization_scope": "create_isolated_database_and_build_generations_to_ready_only",
  "authorization_state": "authorized_for_next_controlled_build_to_ready_only",
  "authorized": true,
  "build_manifest_digest": "fdd46786cc78aa43ca47a6aca3091374d7bd37cdf24e5791017ee0c7a1275339",
  "census_digest": "0cf872e3822494bb0fe9c4be7f0e2adb0009d3330ef96b2461a89c5192302446",
  "corpus_digest": "e086e48dda72b9bc38f6cb4d4f68a60bc5af7dfa38b47b49659fc3312a2efd9b",
  "decision_reference": "mnemo-v2-index-build-human-authorization-2026-09-01",
  "generation_namespace": "full_multilingual_v2",
  "profile_fingerprint": "51eb57f1f252d4e3e771668be8a70316303ede40c97cf0d3d25f7d20ed728034",
  "run_id": "0b04f05c-a3d5-5879-b878-cd5f8e84ff2f",
  "schema_version": "mnemo.v2-build-authorization/1",
  "storage_manifest_digest": "0f34a97fd64301d86ccbe8d15dad08bb7442ff484a4e5166d8ec0056b2220ed7",
  "target_database_path": "scratch/phase8_5_full_multilingual_v2/build-20260831-01/mnemo.db",
  "vector_space_identity": "7dcba654e1c947145253ff65ef93e2b4ef1105cdf680b79218a446c79cc1a0d7"
}
